p4@p4:~$ sudo tcpdump -i s1-eth1 -nn -v
tcpdump: listening on s1-eth1, link-type EN10MB (Ethernet), capture size 262144 bytes
21:21:49.766936 IP6 (hlim 255, next-header ICMPv6 (58) payload length: 16) fe80::b8b1:ddff:fefd:7494 > ff02::2: [icmp6 sum ok] ICMP6, router solicitation, length 16
          source link-address option (1), length 8 (1): 00:00:00:00:02:00
21:21:49.825081 ARP, Ethernet (len 6), IPv4 (len 4), Request who-has 10.0.0.2 tell 10.0.0.1, length 28
21:21:49.825129 ARP, Ethernet (len 6), IPv4 (len 4), Reply 10.0.0.2 is-at 00:00:00:00:02:00, length 28
21:21:49.828333 ARP, Ethernet (len 6), IPv4 (len 4), Reply 10.0.0.2 is-at 00:00:00:00:02:00, length 28
21:21:49.849158 IP (tos 0x0, ttl 64, id 1, offset 0, flags [none], proto TCP (6), length 40)
    10.0.0.1.12345 > 10.0.0.2.12345: Flags [S], cksum 0x1b0a (correct), seq 100, win 8192, length 0
21:21:49.849231 IP (tos 0x0, ttl 64, id 0, offset 0, flags [DF], proto TCP (6), length 40)
    10.0.0.2.12345 > 10.0.0.1.12345: Flags [R.], cksum 0x3af7 (correct), seq 0, ack 101, win 0, length 0
21:21:49.850893 IP (tos 0x0, ttl 64, id 1, offset 0, flags [none], proto TCP (6), length 40)
    10.0.0.2.12345 > 10.0.0.1.12345: Flags [S.], cksum 0x1af9 (correct), seq 0, ack 101, win 8192, length 0
21:21:49.850956 IP (tos 0x0, ttl 64, id 0, offset 0, flags [DF], proto TCP (6), length 40)
    10.0.0.1.12345 > 10.0.0.2.12345: Flags [R], cksum 0x3b07 (correct), seq 101, win 0, length 0
21:21:49.850987 IP (tos 0x0, ttl 64, id 0, offset 0, flags [DF], proto TCP (6), length 40)
    10.0.0.2.12345 > 10.0.0.1.12345: Flags [R.], cksum 0x3af7 (correct), seq 0, ack 1, win 0, length 0
21:21:49.852881 IP (tos 0x0, ttl 64, id 0, offset 0, flags [DF], proto TCP (6), length 40)
    10.0.0.1.12345 > 10.0.0.2.12345: Flags [R], cksum 0x3b07 (correct), seq 101, win 0, length 0
21:21:55.012270 ARP, Ethernet (len 6), IPv4 (len 4), Request who-has 10.0.0.1 tell 10.0.0.2, length 28
21:21:55.012347 ARP, Ethernet (len 6), IPv4 (len 4), Reply 10.0.0.1 is-at 00:00:00:00:00:01, length 28
21:21:55.013242 ARP, Ethernet (len 6), IPv4 (len 4), Request who-has 10.0.0.1 tell 10.0.0.2, length 28
21:21:55.013252 ARP, Ethernet (len 6), IPv4 (len 4), Reply 10.0.0.1 is-at 00:00:00:00:00:01, length 28
21:21:55.013571 ARP, Ethernet (len 6), IPv4 (len 4), Reply 10.0.0.1 is-at 00:00:00:00:00:01, length 28
21:21:55.013855 ARP, Ethernet (len 6), IPv4 (len 4), Reply 10.0.0.1 is-at 00:00:00:00:00:01, length 28
tcpdump: pcap_loop: The interface went down
16 packets captured
16 packets received by filter
0 packets dropped by kernel
p4@p4:~$
